,title,score,id,url,comms_num,created,body
0,Pelosi's husband buying over $1 million of computer chip stock ahead of vote,5794,w2x1ts,https://www.reddit.com/r/stocks/comments/w2x1ts/pelosis_husband_buying_over_1_million_of_computer/,460,1658248545.0,"[Full Article](https://www.msn.com/en-us/tv/news/cnn-msnbc-abc-cbs-nbc-ignore-pelosis-husband-buying-over-dollar1-million-of-computer-chip-stock-ahead-of-vote/ar-AAZKFKr?li=BBnb7Kz)

Paul Pelosi, House Speaker Nancy Pelosi's husband, made a stock purchase of over $1 million in a computer chip company just weeks before a potential vote in Congress which would give a massive subsidy to the industry. 

 Mr. Pelosi made a purchase of between $1 million and $5 million [shares of Nvidia](https://www.foxbusiness.com/category/stocks), a semiconductor company, according to a disclosure filing made by Speaker Pelosi's office. He exercised 200 call options, or 20,000 shares, the disclosure states. The disclosure raised eyebrows, as Reuters reported that the Senate could vote on a bill that contains billions of dollars in subsidies within the semiconductor industry as early as Tuesday. 

Curtis Houck, managing editor of right-leaning media watchdog NewsBusters, said it was ""no accident that the liberal media have made the decision to ignore"" the story that could damage Pelosi. 

""For those that are aware of it, they have zero comprehension and/or shame to realize how it's a quintessential story of how the elites work for their own financial benefit, not that of the American people,"" Houck told Fox News Digital. 

Meanwhile, Nancy Pelosi's office has attempted to distance the House Speaker from her husband’s recent stock trades. 

""The Speaker does not own any stocks. As you can see from the required disclosures, with which the Speaker fully cooperates, these transactions are marked ‘SP’ for Spouse. The Speaker has no prior knowledge or subsequent involvement in any transactions,"" spokesman Drew Hammill told FOX Business. 

In 2020, Republican Sen. Richard Burr, N.C., and other high-profile lawmakers came under fire for stock sales in the run-up to the COVID-19 pandemic that were suspected to have been made based on confidential information about the pending outbreak. CNN, MSNBC, ABC, CBS and NBC all covered the story. ""The Rachel Maddow Show"" even featured a lengthy commentary about it. 

 Charlie Gasparino appeared on ""Tucker Carlson Tonight"" on Monday to discuss whether the move could be insider trading. 

""This dude is a rising star on Wall Street,"" Gasparino joked before taking a serious tone. 

""Obviously this brings up the notion, is this insider trading? Is she giving him some tips? We should point out that the SEC and the DOJ have brought cases on insider tips via pillow talk. Trust me on this. It’s happened,"" he said. ""I don’t believe this hits the insider trading bar… a lot of information about this legislation was bouncing around, it has to be material, non-public, stolen, misappropriated. It kind of doesn’t hit those barriers. But what this does hit is limousine liberalism, arrogance on steroids."" "
1,Britain blocks Microsoft’s $69 billion acquisition of Activision Blizzard,3181,12zeetm,https://www.reddit.com/r/stocks/comments/12zeetm/britain_blocks_microsofts_69_billion_acquisition/,598,1682508059.0,"LONDON — Britain’s top competition regulator on Wednesday moved to block[ Microsoft](https://www.cnbc.com/quotes/MSFT/)’s acquisition of video game publisher [Activision Blizzard](https://www.cnbc.com/quotes/ATVI/).

The  measure marks a major blow for the U.S. tech giant, as it seeks to  convince authorities that the deal will benefit competition.

Microsoft said it plans to appeal the decision.

The  U.K. Competition and Markets Authority said that it opposed the deal as  it raises competition concerns in the nascent cloud gaming market.

Microsoft  could make Activision’s games exclusive to its cloud gaming platform,  Xbox Game Pass, cuting off distribution to other key players in the  space, the CMA said.

Cloud gaming is a technology that enables  gamers to access games via companies’ remote servers — effectively  streaming a game like you would a movie on Netflix. The technology is  still in its infancy, but Microsoft is betting big on it becoming a  mainstream way of playing games.

Microsoft announced its intention to acquire Activision Blizzard in January 2022 for $69 billion, in [one of the biggest deals the video game industry has seen](https://www.cnbc.com/2022/01/18/microsoft-to-buy-activision.html) to date.

Executives  at the Redmond, Washington-based technology giant believe the  acquisition will boost its efforts in gaming by adding lucrative  franchises like Call of Duty and Candy Crush Saga to its content  offerings.

However, some of Microsoft’s competitors contested the  deal, concerned it may give Microsoft a tight grip on the $200 billion  games market. Of particular concern was the prospect that Microsoft [may shut off distribution access to Activision’s popular Call of Duty franchise](https://www.forbes.com/sites/paultassi/2022/09/16/microsoft-is-growing-tired-of-sonys-call-of-duty-complaints/?sh=bd568595ebb9) for certain platforms.

[Sony](https://www.cnbc.com/quotes/6758.T-JP/), in particular, has voiced concern with Microsoft’s Activision purchase.  The Japanese gaming giant fears that Microsoft could make Call of Duty  exclusive to its Xbox consoles in the long run. 

 Microsoft sought to allay those concerns by offering Sony, [Nintendo](https://www.cnbc.com/quotes/7974.T-JP/), [Nvidia](https://www.cnbc.com/quotes/NVDA/)

and other firms [10-year agreements](https://www.cnbc.com/2022/12/07/microsoft-says-it-will-bring-call-of-duty-to-nintendo-for-10-years.html) to continue bringing Call of Duty to their respective gaming platforms.

Microsoft  argues it wouldn’t be financially beneficial to withhold Call of Duty  from PlayStation, Nintendo and other rivals given the licensing income  it generates from keeping the game available on their platforms.

Microsoft  President Brad Smith told CNBC last month that the company is offering  Sony the same agreement as it did Nintendo — to make Call of Duty  available on PlayStation at the same time as on Xbox, with the same  features. Sony still opposes the deal.

The CMA had raised concerns  with the potential for Microsoft to hinder competition in the nascent  cloud gaming market via its Xbox Game Pass subscription service, which  offers cloud gaming among its perks. Microsoft has committed to bring  new Call of Duty titles to Xbox Game Pass on day one of its release.

Cloud  gaming, or the ability to access games via PC or mobile devices over  the internet, is still in its infancy and requires a strong broadband  connection to work well. According to network intelligence firm  Sandvine, cloud gaming made up less than 1% of global internet traffic  in 2022.

Even with the CMA’s blessing, Microsoft will still need to convince other regulators not to block the deal. The EU [continues to probe the merger](https://www.cnbc.com/2023/02/21/microsoft-will-bring-xbox-games-to-nvidias-cloud-gaming-service.html) to assess whether it hurts competition, while the U.S. Federal Trade Commission [sued to block the deal](https://www.cnbc.com/2022/12/08/ftc-sues-to-block-microsofts-acquisition-of-game-giant-activision-blizzard.html) on antitrust grounds. Microsoft sought to allay those concerns by offering Sony, [Nintendo](https://www.cnbc.com/quotes/7974.T-JP/), [Nvidia](https://www.cnbc.com/quotes/NVDA/)

and other firms [10-year agreements](https://www.cnbc.com/2022/12/07/microsoft-says-it-will-bring-call-of-duty-to-nintendo-for-10-years.html) to continue bringing Call of Duty to their respective gaming platforms.

Microsoft  argues it wouldn’t be financially beneficial to withhold Call of Duty  from PlayStation, Nintendo and other rivals given the licensing income  it generates from keeping the game available on their platforms.

Microsoft  President Brad Smith told CNBC last month that the company is offering  Sony the same agreement as it did Nintendo — to make Call of Duty  available on PlayStation at the same time as on Xbox, with the same  features. Sony still opposes the deal.

The CMA had raised concerns  with the potential for Microsoft to hinder competition in the nascent  cloud gaming market via its Xbox Game Pass subscription service, which  offers cloud gaming among its perks. Microsoft has committed to bring  new Call of Duty titles to Xbox Game Pass on day one of its release.

Cloud  gaming, or the ability to access games via PC or mobile devices over  the internet, is still in its infancy and requires a strong broadband  connection to work well. According to network intelligence firm  Sandvine, cloud gaming made up less than 1% of global internet traffic  in 2022.

Even with the CMA’s blessing, Microsoft will still need to convince other regulators not to block the deal. The EU [continues to probe the merger](https://www.cnbc.com/2023/02/21/microsoft-will-bring-xbox-games-to-nvidias-cloud-gaming-service.html) to assess whether it hurts competition, while the U.S. Federal Trade Commission [sued to block the deal](https://www.cnbc.com/2022/12/08/ftc-sues-to-block-microsofts-acquisition-of-game-giant-activision-blizzard.html) on antitrust grounds."
2,Cathie Wood's ARK Invest sold most of its Nvidia stake just before the chipmaker kicked off a rally that added $585 billion in market value,2354,13rxgz6,https://www.reddit.com/r/stocks/comments/13rxgz6/cathie_woods_ark_invest_sold_most_of_its_nvidia/,405,1685058945.0,"Cathie Wood's Ark Invest is probably wishing it didn't sell nearly 1 million shares of Nvidia between early October and today following the chipmaker's massive year-to-date surge of more than 160%.

Nvidia stock soared as much as 30% on Thursday after the company announced jaw-dropping guidance as it benefits from a wave of demand for its chipsets that support generative AI technology platforms like OpenAI's ChatGPT and Alphabet's Bard.

But the active investment manager, who has owned Nvidia on and off since the flagship fund's inception in 2014, missed out on massive gains as it started to pare down its position in Nvidia heading into a 52-week low in mid-October.

Since Ark Invest's first sale on October 5, when it held 1.3 million shares of Nvidia across all of its ETFs, the stock has soared 190% and added $620 billion to its market value. By late November, Nvidia owned just over 500,000 shares of the company.

Today, Ark Invest holds just 390,000 shares across its suite of next-generation technology ETFs. The stock is not in its flagship Disruptive Innovation fund.

Rough calculations by Insider suggest Ark Invest left more than $200 million in potential profits on the table when it sold down its Nvidia stake throughout the end of last year. 

Ark's ill-timed share sale of Nvidia highlights the difficulties of actively managing a portfolio of disruption-focused investments, because even if you pick the right theme to invest in, there's no guarantee you'll pick the right companies to bet on.

**In February, Wood said Ark's wave of Nvidia sales was in part because its valuation was ""very high"" and that it was consolidating its portfolio into higher conviction names.**

""We like Nvidia, we think it's going to be a good stock. It's priced, it's the 'check-the-box' AI company. For a flagship fund, where we're consolidated towards our highest conviction names, part of that has to do with the valuation,"" she told CNBC on February 27.

Wood is instead counting on UiPath for Ark Invest's exposure to artificial intelligence, which is its second largest position across all of its ETFs. Meanwhile, Tesla remains Ark Invest's top holding, which is also working on artificial intelligence to help enable its self-driving technology. 

But despite the hype in AI this year, those two stocks have only captured some of the year-to-date gains seen across the space. Shares of UIPath are up just 14% year-to-date, while Tesla stock is up an impressive 50%. 

Shares of Ark Invest's Disruptive Innovation ETF were down 2.7% on Thursday, despite the Nasdaq 100 jumping 1.7%. 

https://markets.businessinsider.com/news/stocks/cathie-wood-ark-invest-sold-nvidia-stake-before-ai-rally-2023-5?"
3,"EU approves Microsoft’s $69 billion acquisition of Activision Blizzard, clearing major hurdle",2232,13ia8cg,https://www.reddit.com/r/stocks/comments/13ia8cg/eu_approves_microsofts_69_billion_acquisition_of/,312,1684161583.0,"https://www.cnbc.com/2023/05/15/microsoft-activision-deal-eu-approves-takeover-of-call-of-duty-maker.html

European Union regulators on Monday approved Microsoft’s proposed $69 billion acquisition of gaming firm Activision Blizzard, subject to remedies offered by the U.S. tech giant. The European Commission, the EU’s executive arm, said that Microsoft offered remedies in the nascent area of cloud gaming that have staved off antitrust concerns. These remedies centered on allowing users to stream Activision games they purchase on any cloud streaming platform. Europe’s green light is a huge win for Microsoft, after the U.K.’s top competition authority last month blocked the deal. Regulators globally have been probing whether Microsoft’s acquisition of Activision could distort competition in the console and cloud gaming market. One area regulators questioned is whether Microsoft might take Activision games and keep them exclusively on the U.S. giant’s own platforms. Activision is behind some of the biggest console and PC games in the world, including the Call of Duty franchise and World of Warcraft.

The EU decision comes after the U.K. Competition and Markets Authority last month blocked the deal over concerns that it would reduce competition in the nascent cloud gaming market. The CMA said that Microsoft would find it commercially beneficial to make Activision’s key games, such as Call of Duty, exclusive to its own cloud gaming platforms. The CMA nevertheless said the acquisition would not reduce competition in the console market.

Microsoft has faced opposition to the deal from regulators and some of its rivals, including PlayStation games console maker Sony. Microsoft sought to allay the Commission’s concerns over making Activision games exclusive ahead of the EU decision. Microsoft President Brad Smith met with EU officials in February, after which the tech giant said it would bring Xbox PC games to Nvidia’s cloud gaming service. The chipmaker had reportedly expressed opposition to the acquisition takeover. Microsoft also signed a 10-year deal with Nintendo to bring Call of Duty to the Japanese gaming giant’s platforms, if the Activison deal closes."
4,These 10 companies face huge tax bills with the Democrats new 15% minimum corporate tax,1799,wil6gp,https://www.reddit.com/r/stocks/comments/wil6gp/these_10_companies_face_huge_tax_bills_with_the/,583,1659893546.0,"Utility American Water Works Company (ticker: AWK) has recently enjoyed a cash tax rate of 0.1% and has brought in a pretax profit of $1.1 billion on average in the past three years. Its peer, [Ameren ](https://www.barrons.com/market-data/stocks/aee)(AEE), has had a 0.1% cash tax rate and pretax profit of $1.1 billion, as well. 

Advanced Micro Devices (AMD) has had a 1% tax rate and average pretax profit of $1.8 billion.  [Nvidia **NVDA** **–1.18%** ](https://www.barrons.com/market-data/stocks/nvda) (NVDA) has had a 4.7% tax rate and average pretax profit of $4.8 billion.  [Broadcom ](https://www.barrons.com/market-data/stocks/avgo)(AVG) has had a 6.8% tax rate and pretax profit of $6.8 billon.  

[Apollo Global Management **APO** **–0.79%** ](https://www.barrons.com/market-data/stocks/apo) (APO) has had a 5.1% tax rate and pretax profit $2.3 billion. 

[Ford Motor **F** **–0.46%** ](https://www.barrons.com/market-data/stocks/f) (F) has had a 4.3% tax rate and pretax profit of $4.93 billion.  [Tesla **TSLA** **–6.63%** ](https://www.barrons.com/market-data/stocks/tsla) (TSLA) has had a 5.3% tax rate and pretax profit of $2.3 billion. 

[Amazon.com **AMZN** **–1.24%** ](https://www.barrons.com/market-data/stocks/amzn) (AMZN) has had a 9% tax rate and pretax profit of $25.4 billion. 

[Salesforce ](https://www.barrons.com/market-data/stocks/crm)(CRM) has had a 3.1% tax rate and pretax profit of $1.6 billion. 

These companies are candidates to see lowered earnings from higher taxes. "
5,Nvidia hits $1 trillion market cap,1428,13vr1zd,https://www.reddit.com/r/stocks/comments/13vr1zd/nvidia_hits_1_trillion_market_cap/,468,1685455008.0,"https://www.cnbc.com/2023/05/30/nvidia-on-track-to-hit-1-trillion-market-cap-when-market-opens.html

Nvidia briefly hit a $1 trillion market cap at the open Tuesday, joining a small club of mostly technology companies. Nvidia’s shares have to hold above $404.86 to maintain that distinction throughout the day. The chipmaker’s stock rocketed last week after it posted quarterly earnings with top- and bottom-line numbers that significantly beat consensus estimates. Nvidia’s gain buoyed other chipmakers, with the notable exception of Intel, and was also fueled in part by estimates that were more optimistic than expected.

Significantly, Nvidia forecast $11 billion in sales for the fiscal second quarter of 2024 alone. Expected sales were 50% higher than consensus estimates of $7.15 billion. It’s been a banner year for chipmakers, parts of the tech industry and the Nasdaq, driven in part by the AI frenzy and the possibility of slowing Federal Reserve rate hikes. Alongside Nvidia, Alphabet, Meta and Microsoft were also buoyed in last week’s trading.

Nvidia’s graphics processing units, or GPUs, are critical to generative AI platforms like OpenAI’s ChatGPT and Google’s Bard. The company has historically been a leader in the so-called “discrete” or standalone GPU field, but until recently, many consumers thought of GPUs as primarily used for intensive gaming. The advent of crypto mining and AI has upended that belief, and GPU manufacturers and suppliers, including Nvidia, AMD and TSMC, have seen share prices rise significantly over the last few months. By contrast, Intel, which struggled with inventory issues and development challenges, has been historically focused on the chip market for central processing units, or CPUs. The company hasn’t shared, comparatively, in the wave of investor interest."
6,Apple’s “Wearables & Accessories” revenue ($41.24B) is significantly greater than Nvidia’s annual revenue (26.91B).,1380,12buzi8,https://www.reddit.com/r/stocks/comments/12buzi8/apples_wearables_accessories_revenue_4124b_is/,206,1680639142.0,"I read a comment here that Apple makes more money from AirPods than Nvidia makes in total. 

I couldn’t find the wearables revenue broken down by product but you can compare the total from this category as a whole. 

What’s your reaction to this comparison?"
7,"Nvidia earnings fall short, Q3 forecast misses by $1 billion",1264,wwuoob,https://www.reddit.com/r/stocks/comments/wwuoob/nvidia_earnings_fall_short_q3_forecast_misses_by/,400,1661374923.0,"Nvidia ([NVDA](https://finance.yahoo.com/quote/NVDA?p=NVDA&.tsrc=fin-srch)) [announced its fiscal Q2 earnings](https://nvidianews.nvidia.com/news/nvidia-announces-financial-results-for-second-quarter-fiscal-2023) after the bell on Wednesday, missing on earnings per share and falling short on Q3 forecasts amid a slowdown in PC and gaming sales following the explosive growth the sectors saw in 2020 and 2021. Here are the most important numbers from the report compared to what analysts were expecting.

* **Revenue:** $6.7 billion versus $6.7 billion expected
* **Adj. EPS:** $0.51 versus $0.53 expected
* **Data Center:** $3.8 billion versus $3.8 billion expected
* **Gaming:** $2.0 billion versus $2.0 billion expected

Net income for the company fell 72% year-over-year to $656 million. Shares of Nvidia were down more than 2% following the announcement.

Nvidia also announced Q3 revenue projections that fell short of expectations, saying it will bring in $5.9 billion in the quarter. Wall Street was looking for $6.9 billion.

""We are navigating our supply chain transitions in a challenging macro environment and we will get through this,” Nvidia founder and CEO Jensen Huang said in a statement.

Nvidia released its preliminary earnings on Aug. 8, warnings investors that the company was going to miss on its own expectations for the quarter as gaming sales continued to plummet.

According to the company's numbers, gaming segment revenue dropped an eye-watering 33% year-over-year and 44% quarter-over-quarter. Fellow gaming companies including Microsoft ([MSFT](https://finance.yahoo.com/quote/MSFT?p=MSFT&.tsrc=fin-srch)), Sony ([SONY](https://finance.yahoo.com/quote/SONY?p=SONY&.tsrc=fin-srch)), Nintendo ([NTDOY](https://finance.yahoo.com/quote/NTDOY?p=NTDOY&.tsrc=fin-srch)), and others have also reported a drop in game hardware spending."
8,"NVIDIA beat earnings, top expectations.",1174,13qwxsw,https://www.reddit.com/r/stocks/comments/13qwxsw/nvidia_beat_earnings_top_expectations/,854,1684960579.0,"Nvidia reported its fiscal first quarter earnings after the bell on Wednesday, beating analysts' expectations on the top and bottom line on the strength of its data center business. The company also said it expects Q2 revenue to come in at about $11 billion, plus or minus 2%. Wall Street was expecting $7.2 billion.

Nvidia is at the center of the AI explosion thanks to its high-powered graphics cards and server products, and its stock price is soaring. Over the last year, shares of Nvidia have jumped 77%, while rival AMD has jumped 12%. Intel shares are down 30% in the same timeframe.

Here are the most important numbers from the report compared to what was expecting, as compiled by Bloomberg.

Revenue: $7.2 billion versus $6.5 billion expected

Adj. EPS: $1.09 versus $0.92 expected

Gaming: $2.2 billion versus $1.9 billion expected

Data center: $4.2 billion versus $3.9 billion expected

Shares of Nvidia were up more than 13% following the announcement.

“The computer industry is going through two simultaneous transitions — accelerated computing and generative AI,” Nvidia CEO Jensen Huang said in a statement."
9,Intel to invest $4.6 billion in new chip plant in Poland,1062,14avon6,https://www.reddit.com/r/stocks/comments/14avon6/intel_to_invest_46_billion_in_new_chip_plant_in/,261,1686918820.0,"Intel plans to invest up to $4.6 billion in a new semiconductor assembly and test facility near Wrocław, Poland, as part of a multi-billion-dollar investment drive across Europe to build chip capacity, it said on Friday.

The U.S. chipmaker last year announced plans to build a big chip complex in Germany along with facilities in Ireland and France as it seeks to benefit from European Commission's eased funding rules and subsidies as the EU looks to cut its dependence on U.S. and Asian supply.

The facility in Poland will employ 2,000 workers and create several thousand additional jobs during the construction phase and hiring by suppliers, the company said in a statement.

""Poland was just a little bit hungrier to win this site,"" Intel CEO Pat Gelsinger said in a news conference.

Several countries have been vying to get Intel to invest in their regions and some, like Germany, who have secured a commitment from Intel, have been in talks on the amount of subsidies they can doll out.

Handelsblatt newspaper reported on Thursday that the German government and Intel were close to an agreement for 9.9 billion euros ($10.83 billion) in subsidies, up from a previously agreed 6.8 billion.

""We are not asking for handouts, we are asking for competitiveness,"" Gelsinger said in an interview.

""Labour costs have gone up substantially, material costs have gone up substantially, so all of a sudden, the cost gap was bigger than we had originally estimated.""

German Chancellor Olaf Scholz will meet with Gelsinger on Monday, a government spokesperson said in Berlin.

Gelsinger declined to provide detail on the subsidy amount, but said he hopes to come to an agreement.

""The gaps are too big. If we close them, we shake hands, and we are going forward,"" Gelsinger said.

The level of any subsidy offered to Intel by Poland was not made public during Friday's announcement.

Design and planning for the facility will begin immediately, with construction to commence pending European Commission approval.

Mateusz Morawiecki, prime minister of Poland, called Intel's factory ""the largest greenfield investment in the history of Poland"".

The company, which has been in the country for 30 years and employs 4,000 workers, said it chose Poland because of its infrastructure, available talent and noted the site is close to its planned factory in Germany and its site in Ireland.

It expects the facility to come online by 2027.

Intel under Gelsinger has been investing billions in building factories across three continents to restore its dominance in chip making and better compete with rivals AMD, NVIDIA and Samsung.

https://www.reuters.com/technology/intel-invest-46-bln-new-chip-plant-poland-2023-06-16/"
